{
  "format": "machinome-movie/0.1",
  "id": "bare",
  "title": "Bare",
  "root": "..",
  "output": {
    "width": 320,
    "height": 180,
    "fps": 10
  },
  "model": {
    "manifest": "../../export/fixture/manifest.json",
    "expectedDurationSeconds": 20,
    "timeMode": "normalized-loop",
    "sourceRevision": "ef62273f3a1c8f435f208ec027d18fba5dbb0b5b",
    "readiness": "Fixture export."
  },
  "audio": {
    "provider": "elevenlabs",
    "model": "test-model",
    "voice": "test-voice",
    "outputFormat": "pcm_24000"
  },
  "cameras": {
    "wide": {
      "position": [
        0,
        -10,
        4
      ],
      "target": [
        0,
        0,
        0
      ],
      "up": [
        0,
        0,
        1
      ],
      "fov": 37
    }
  },
  "layers": {},
  "evidence": {},
  "chapters": [
    {
      "id": "opening",
      "narration": "The wheel turns.",
      "shots": [
        {
          "id": "wheel",
          "until": 2,
          "simulation": {
            "from": 0,
            "to": 2
          },
          "camera": [
            {
              "at": 0,
              "preset": "wide"
            }
          ],
          "hiddenLayers": [],
          "overlays": [],
          "evidence": []
        }
      ]
    }
  ]
}
