{
  "audio": {
    "model": "eleven_v3",
    "provider": "elevenlabs",
    "voice": "fixture-voice"
  },
  "cameras": {
    "far": {
      "fov": 37,
      "position": [
        400,
        -600,
        300
      ],
      "target": [
        0,
        0,
        50
      ],
      "up": [
        0,
        0,
        1
      ]
    },
    "near": {
      "fov": 37,
      "position": [
        200,
        -300,
        150
      ],
      "target": [
        0,
        0,
        50
      ],
      "up": [
        0,
        0,
        1
      ]
    },
    "rolled": {
      "fov": 42,
      "position": [
        -150,
        250,
        120
      ],
      "target": [
        0,
        0,
        60
      ],
      "up": [
        0.15,
        0,
        1
      ]
    },
    "side": {
      "fov": 30,
      "position": [
        0,
        -500,
        100
      ],
      "target": [
        0,
        0,
        50
      ],
      "up": [
        0,
        0,
        1
      ]
    }
  },
  "chapters": [
    {
      "id": "only",
      "narration": "A seesaw.",
      "shots": [
        {
          "camera": [
            {
              "at": 0,
              "preset": "far"
            }
          ],
          "evidence": [],
          "hiddenLayers": [],
          "id": "whole",
          "overlays": [],
          "set": "paper",
          "simulation": {
            "from": 0,
            "to": 2
          },
          "until": {
            "plus": 0.5,
            "spokenEnd": "seesaw"
          }
        }
      ]
    }
  ],
  "clips": {},
  "evidence": {},
  "format": "machinome-movie/0.1",
  "id": "minimal",
  "layers": {
    "ground": [
      [
        "Base"
      ]
    ],
    "load": [
      [
        "Beam",
        "Plank"
      ],
      [
        "Beam",
        "Weight"
      ]
    ]
  },
  "learningGoal": "Show the smallest movie that evaluates.",
  "marks": {
    "fall": 15,
    "rise": 5,
    "top": 10
  },
  "model": {
    "expectedDurationSeconds": 20,
    "manifest": "../../export/seesaw/manifest.json",
    "readiness": "Fixture export written by hand; nothing is simulated.",
    "sourceRevision": "6bf22d069229248c0a3208ab7a70900a295afa50",
    "timeMode": "normalized-loop"
  },
  "output": {
    "fps": 10,
    "height": 360,
    "width": 640
  },
  "root": "../../python/tests/fixtures/project/videos/minimal",
  "sourceCode": {
    "declaration": {
      "file": "../../models/seesaw.py",
      "lines": [
        22,
        24
      ]
    }
  },
  "status": "rehearsal",
  "stills": {
    "plate": {
      "credit": "Fixture drawing of a seesaw",
      "file": "../../media/plate.png",
      "rights": "Made for the Videomaker test suite",
      "upscale": 1.5
    }
  },
  "title": "Minimal"
}
